{
  "schema_version": "1.0",
  "id": "bio_recipes",
  "display_name": "Bionics Systems Recipes",
  "short_description": "Adds Autodoc, Autodoc couch to construction menu and Anesthethics to Chem crafting",
  "author": [
    "Chalne"
  ],
  "license": "ALL-RIGHTS-RESERVED",
  "homepage": "https://github.com/Zlorthishen/BrightNights-Structured-Kenan-Modpack/tree/master/Kenan-BrightNights-Structured-Modpack/High-Maintenance-Huge-Mods/Bionics_Recipes",
  "version": "0.0.0",
  "yanked": {
    "reason": "Kenan modpack entries are no longer tracked in this registry."
  },
  "dependencies": {
    "bn": ">=0.9.1"
  },
  "source": {
    "type": "github_archive",
    "url": "https://github.com/Zlorthishen/BrightNights-Structured-Kenan-Modpack/archive/refs/heads/master.zip",
    "commit_sha": "142b53ba0079e9c0aea3e8e674ad17a7dc193d07",
    "extract_path": "Kenan-BrightNights-Structured-Modpack/High-Maintenance-Huge-Mods/Bionics_Recipes"
  },
  "categories": [
    "items"
  ],
  "modinfo_url": "https://raw.githubusercontent.com/Zlorthishen/BrightNights-Structured-Kenan-Modpack/142b53ba0079e9c0aea3e8e674ad17a7dc193d07/Kenan-BrightNights-Structured-Modpack/High-Maintenance-Huge-Mods/Bionics_Recipes/modinfo.json",
  "uses_lua": false,
  "autoupdate": {
    "type": "commit",
    "branch": "master"
  },
  "last_updated": "2026-06-23T02:40:38Z"
}
