{
  "schema_version": "1.0",
  "id": "kingsman",
  "display_name": "Kingsman Umbrella",
  "short_description": "Adds the Umbrella gun from Kingsman - The Secret Service.",
  "author": [
    "Broken \"Spaghetti\" Admin"
  ],
  "license": "ALL-RIGHTS-RESERVED",
  "homepage": "https://github.com/Zlorthishen/BrightNights-Structured-Kenan-Modpack/tree/master/Kenan-BrightNights-Structured-Modpack/Medium-Maintenance-Small-Mods/Kingsman",
  "version": "0.0.0",
  "yanked": {
    "reason": "Kenan modpack entries are no longer tracked in this registry."
  },
  "dependencies": {
    "bn": ">=0.9.1"
  },
  "source": {
    "type": "github_archive",
    "url": "https://github.com/Zlorthishen/BrightNights-Structured-Kenan-Modpack/archive/refs/heads/master.zip",
    "commit_sha": "142b53ba0079e9c0aea3e8e674ad17a7dc193d07",
    "extract_path": "Kenan-BrightNights-Structured-Modpack/Medium-Maintenance-Small-Mods/Kingsman"
  },
  "categories": [
    "items"
  ],
  "modinfo_url": "https://raw.githubusercontent.com/Zlorthishen/BrightNights-Structured-Kenan-Modpack/142b53ba0079e9c0aea3e8e674ad17a7dc193d07/Kenan-BrightNights-Structured-Modpack/Medium-Maintenance-Small-Mods/Kingsman/modinfo.json",
  "uses_lua": false,
  "autoupdate": {
    "type": "commit",
    "branch": "master"
  },
  "last_updated": "2026-06-21T10:17:32+09:00"
}
