{
  "schema_version": "1.0",
  "id": "lones_atomic_additions",
  "display_name": "Lones Atomic additions",
  "short_description": "Adds many new atomic gears to BN!",
  "description": "Adds many new atomic gears to BN!",
  "author": [
    "Thelonestander"
  ],
  "license": "ALL-RIGHTS-RESERVED",
  "homepage": "https://github.com/thelonestander/Lones-atomic-additions/tree/main/Lones Atomic additions",
  "version": "2026.6.11-5652911",
  "previous_releases": [
    {
      "version": "0.0.0",
      "source": {
        "type": "github_archive",
        "url": "https://github.com/thelonestander/Lones-atomic-additions/archive/refs/heads/main.zip",
        "commit_sha": "c3409e3122101d2daa7470e97351110286074658",
        "extract_path": "Lones Atomic additions"
      },
      "released_at": "2026-05-16T09:25:21.740Z"
    },
    {
      "version": "2026.6.8-ce03e21",
      "source": {
        "type": "github_archive",
        "url": "https://github.com/thelonestander/Lones-atomic-additions/archive/refs/heads/main.zip",
        "commit_sha": "ce03e214e3972489a5005a001002363ee2f8efd0",
        "extract_path": "Lones Atomic additions"
      },
      "released_at": "2026-06-08T03:02:43.346Z"
    },
    {
      "version": "2026.6.9-ce03e21",
      "source": {
        "type": "github_archive",
        "url": "https://github.com/thelonestander/Lones-atomic-additions/archive/refs/heads/main.zip",
        "commit_sha": "ce03e214e3972489a5005a001002363ee2f8efd0",
        "extract_path": "Lones Atomic additions"
      },
      "released_at": "2026-06-09T02:39:33.369Z"
    },
    {
      "version": "2026.6.10-5652911",
      "source": {
        "type": "github_archive",
        "url": "https://github.com/thelonestander/Lones-atomic-additions/archive/refs/heads/main.zip",
        "commit_sha": "565291116383ec20aea8aae5ec2f62d6a6b9fe8a",
        "extract_path": "Lones Atomic additions"
      },
      "released_at": "2026-06-10T02:55:42.761Z"
    }
  ],
  "dependencies": {
    "bn": ">=0.9.1"
  },
  "source": {
    "type": "github_archive",
    "url": "https://github.com/thelonestander/Lones-atomic-additions/archive/refs/heads/main.zip",
    "commit_sha": "565291116383ec20aea8aae5ec2f62d6a6b9fe8a",
    "extract_path": "Lones Atomic additions"
  },
  "categories": [
    "content"
  ],
  "modinfo_url": "https://raw.githubusercontent.com/thelonestander/Lones-atomic-additions/c3409e3122101d2daa7470e97351110286074658/Lones%20Atomic%20additions/modinfo.json",
  "uses_lua": false,
  "autoupdate": {
    "type": "commit",
    "branch": "main"
  },
  "last_updated": "2026-06-11T02:58:15.667Z"
}
