{
  "schema_version": "1.0",
  "id": "mutant_animals",
  "display_name": "Mutant Animals",
  "short_description": "Expansion for animals that makes them evolve over time into new mutated versions. Some of them, though, they are weird, become tameable, very friendly, useful mutated versions. Some of them, however,",
  "author": [
    "Sunshine"
  ],
  "license": "ALL-RIGHTS-RESERVED",
  "homepage": "https://github.com/Zlorthishen/BrightNights-Structured-Kenan-Modpack/tree/master/Kenan-BrightNights-Structured-Modpack/High-Maintenance-Huge-Mods/Mutant_Animals",
  "version": "0.0.0",
  "yanked": {
    "reason": "Kenan modpack entries are no longer tracked in this registry."
  },
  "dependencies": {
    "bn": ">=0.9.1"
  },
  "source": {
    "type": "github_archive",
    "url": "https://github.com/Zlorthishen/BrightNights-Structured-Kenan-Modpack/archive/refs/heads/master.zip",
    "commit_sha": "142b53ba0079e9c0aea3e8e674ad17a7dc193d07",
    "extract_path": "Kenan-BrightNights-Structured-Modpack/High-Maintenance-Huge-Mods/Mutant_Animals"
  },
  "categories": [
    "creatures"
  ],
  "modinfo_url": "https://raw.githubusercontent.com/Zlorthishen/BrightNights-Structured-Kenan-Modpack/142b53ba0079e9c0aea3e8e674ad17a7dc193d07/Kenan-BrightNights-Structured-Modpack/High-Maintenance-Huge-Mods/Mutant_Animals/modinfo.json",
  "uses_lua": false,
  "autoupdate": {
    "type": "commit",
    "branch": "master"
  },
  "last_updated": "2026-06-08T09:00:53+09:00"
}
