{
  "schema_version": "1.0",
  "id": "xl_armors_makeshift_stuff",
  "display_name": "XL Armors for More Makeshift Stuff",
  "short_description": "This is an extension that adds XL armors for the More Makeshift Stuff mod.",
  "description": "This is an extension that adds XL armors for the More Makeshift Stuff mod.",
  "author": [
    "leoCottret"
  ],
  "license": "ALL-RIGHTS-RESERVED",
  "homepage": "https://github.com/leoCottret/cbn-leocottret-mods/tree/main/MODS/XL_ARMORS_KENAN_MODPACK/XL_Armors_More_Makeshift_Stuff",
  "version": "2026.6.10-2e94b3e",
  "previous_releases": [
    {
      "version": "0.0.0",
      "source": {
        "type": "github_archive",
        "url": "https://github.com/leoCottret/cbn-leocottret-mods/archive/refs/heads/main.zip",
        "commit_sha": "57778ad68c1271f1e7069e5c6a0cebdfd40fa01a",
        "extract_path": "MODS/XL_ARMORS_KENAN_MODPACK/XL_Armors_More_Makeshift_Stuff"
      },
      "released_at": "2026-05-16T09:24:44.653Z"
    },
    {
      "version": "2026.6.8-2e94b3e",
      "source": {
        "type": "github_archive",
        "url": "https://github.com/leoCottret/cbn-leocottret-mods/archive/refs/heads/main.zip",
        "commit_sha": "2e94b3ec069793086efe73923b091a36815c27ae",
        "extract_path": "MODS/XL_ARMORS_KENAN_MODPACK/XL_Armors_More_Makeshift_Stuff"
      },
      "released_at": "2026-06-08T03:02:33.954Z"
    },
    {
      "version": "2026.6.9-2e94b3e",
      "source": {
        "type": "github_archive",
        "url": "https://github.com/leoCottret/cbn-leocottret-mods/archive/refs/heads/main.zip",
        "commit_sha": "2e94b3ec069793086efe73923b091a36815c27ae",
        "extract_path": "MODS/XL_ARMORS_KENAN_MODPACK/XL_Armors_More_Makeshift_Stuff"
      },
      "released_at": "2026-06-09T02:39:22.942Z"
    }
  ],
  "yanked": {
    "reason": "can re-fit armors into XL"
  },
  "dependencies": {
    "makeshift_stuff": "*"
  },
  "source": {
    "type": "github_archive",
    "url": "https://github.com/leoCottret/cbn-leocottret-mods/archive/refs/heads/main.zip",
    "commit_sha": "2e94b3ec069793086efe73923b091a36815c27ae",
    "extract_path": "MODS/XL_ARMORS_KENAN_MODPACK/XL_Armors_More_Makeshift_Stuff"
  },
  "categories": [
    "content"
  ],
  "modinfo_url": "https://raw.githubusercontent.com/leoCottret/cbn-leocottret-mods/57778ad68c1271f1e7069e5c6a0cebdfd40fa01a/MODS/XL_ARMORS_KENAN_MODPACK/XL_Armors_More_Makeshift_Stuff/modinfo.json",
  "uses_lua": false,
  "autoupdate": {
    "type": "commit",
    "branch": "main"
  },
  "last_updated": "2026-06-10T02:55:56.025Z"
}
