{
  "schema_version": "1.0",
  "id": "xl_armors_cbm_arms",
  "display_name": "XL Armors for CBM Equipment",
  "short_description": "This is an extension that adds XL armors for the CBM Equipment mod.",
  "description": "This is an extension that adds XL armors for the CBM Equipment mod.",
  "author": [
    "leoCottret"
  ],
  "license": "ALL-RIGHTS-RESERVED",
  "homepage": "https://github.com/leoCottret/cbn-leocottret-mods/tree/main/MODS/XL_ARMORS_KENAN_MODPACK/XL_Armors_CBMArms",
  "version": "2026.6.25-2a87768",
  "previous_releases": [
    {
      "version": "0.0.0",
      "source": {
        "type": "github_archive",
        "url": "https://github.com/leoCottret/cbn-leocottret-mods/archive/refs/heads/main.zip",
        "commit_sha": "57778ad68c1271f1e7069e5c6a0cebdfd40fa01a",
        "extract_path": "MODS/XL_ARMORS_KENAN_MODPACK/XL_Armors_CBMArms"
      },
      "released_at": "2026-05-16T09:24:44.651Z"
    },
    {
      "version": "2026.6.8-2e94b3e",
      "source": {
        "type": "github_archive",
        "url": "https://github.com/leoCottret/cbn-leocottret-mods/archive/refs/heads/main.zip",
        "commit_sha": "2e94b3ec069793086efe73923b091a36815c27ae",
        "extract_path": "MODS/XL_ARMORS_KENAN_MODPACK/XL_Armors_CBMArms"
      },
      "released_at": "2026-06-08T03:02:28.153Z"
    },
    {
      "version": "2026.6.9-2e94b3e",
      "source": {
        "type": "github_archive",
        "url": "https://github.com/leoCottret/cbn-leocottret-mods/archive/refs/heads/main.zip",
        "commit_sha": "2e94b3ec069793086efe73923b091a36815c27ae",
        "extract_path": "MODS/XL_ARMORS_KENAN_MODPACK/XL_Armors_CBMArms"
      },
      "released_at": "2026-06-09T02:39:16.682Z"
    },
    {
      "version": "2026.6.10-2e94b3e",
      "source": {
        "type": "github_archive",
        "url": "https://github.com/leoCottret/cbn-leocottret-mods/archive/refs/heads/main.zip",
        "commit_sha": "2e94b3ec069793086efe73923b091a36815c27ae",
        "extract_path": "MODS/XL_ARMORS_KENAN_MODPACK/XL_Armors_CBMArms"
      },
      "released_at": "2026-06-10T02:55:42.675Z"
    },
    {
      "version": "2026.6.11-53b55a3",
      "source": {
        "type": "github_archive",
        "url": "https://github.com/leoCottret/cbn-leocottret-mods/archive/refs/heads/main.zip",
        "commit_sha": "53b55a3b6e7fc2632f50111f560f4a72bdb7d13b",
        "extract_path": "MODS/XL_ARMORS_KENAN_MODPACK/XL_Armors_CBMArms"
      },
      "released_at": "2026-06-11T02:58:15.040Z"
    },
    {
      "version": "2026.6.12-53b55a3",
      "source": {
        "type": "github_archive",
        "url": "https://github.com/leoCottret/cbn-leocottret-mods/archive/refs/heads/main.zip",
        "commit_sha": "53b55a3b6e7fc2632f50111f560f4a72bdb7d13b",
        "extract_path": "MODS/XL_ARMORS_KENAN_MODPACK/XL_Armors_CBMArms"
      },
      "released_at": "2026-06-12T03:01:29.477Z"
    },
    {
      "version": "2026.6.13-53b55a3",
      "source": {
        "type": "github_archive",
        "url": "https://github.com/leoCottret/cbn-leocottret-mods/archive/refs/heads/main.zip",
        "commit_sha": "53b55a3b6e7fc2632f50111f560f4a72bdb7d13b",
        "extract_path": "MODS/XL_ARMORS_KENAN_MODPACK/XL_Armors_CBMArms"
      },
      "released_at": "2026-06-13T02:48:49.081Z"
    },
    {
      "version": "2026.6.14-53b55a3",
      "source": {
        "type": "github_archive",
        "url": "https://github.com/leoCottret/cbn-leocottret-mods/archive/refs/heads/main.zip",
        "commit_sha": "53b55a3b6e7fc2632f50111f560f4a72bdb7d13b",
        "extract_path": "MODS/XL_ARMORS_KENAN_MODPACK/XL_Armors_CBMArms"
      },
      "released_at": "2026-06-14T02:59:04.971Z"
    },
    {
      "version": "2026.6.15-53b55a3",
      "source": {
        "type": "github_archive",
        "url": "https://github.com/leoCottret/cbn-leocottret-mods/archive/refs/heads/main.zip",
        "commit_sha": "53b55a3b6e7fc2632f50111f560f4a72bdb7d13b",
        "extract_path": "MODS/XL_ARMORS_KENAN_MODPACK/XL_Armors_CBMArms"
      },
      "released_at": "2026-06-15T03:32:37.879Z"
    },
    {
      "version": "2026.6.16-53b55a3",
      "source": {
        "type": "github_archive",
        "url": "https://github.com/leoCottret/cbn-leocottret-mods/archive/refs/heads/main.zip",
        "commit_sha": "53b55a3b6e7fc2632f50111f560f4a72bdb7d13b",
        "extract_path": "MODS/XL_ARMORS_KENAN_MODPACK/XL_Armors_CBMArms"
      },
      "released_at": "2026-06-16T03:34:32.837Z"
    },
    {
      "version": "2026.6.17-53b55a3",
      "source": {
        "type": "github_archive",
        "url": "https://github.com/leoCottret/cbn-leocottret-mods/archive/refs/heads/main.zip",
        "commit_sha": "53b55a3b6e7fc2632f50111f560f4a72bdb7d13b",
        "extract_path": "MODS/XL_ARMORS_KENAN_MODPACK/XL_Armors_CBMArms"
      },
      "released_at": "2026-06-17T03:26:35.913Z"
    },
    {
      "version": "2026.6.18-53b55a3",
      "source": {
        "type": "github_archive",
        "url": "https://github.com/leoCottret/cbn-leocottret-mods/archive/refs/heads/main.zip",
        "commit_sha": "53b55a3b6e7fc2632f50111f560f4a72bdb7d13b",
        "extract_path": "MODS/XL_ARMORS_KENAN_MODPACK/XL_Armors_CBMArms"
      },
      "released_at": "2026-06-18T03:01:23.506Z"
    },
    {
      "version": "2026.6.19-53b55a3",
      "source": {
        "type": "github_archive",
        "url": "https://github.com/leoCottret/cbn-leocottret-mods/archive/refs/heads/main.zip",
        "commit_sha": "53b55a3b6e7fc2632f50111f560f4a72bdb7d13b",
        "extract_path": "MODS/XL_ARMORS_KENAN_MODPACK/XL_Armors_CBMArms"
      },
      "released_at": "2026-06-19T03:55:50.939Z"
    },
    {
      "version": "2026.6.20-53b55a3",
      "source": {
        "type": "github_archive",
        "url": "https://github.com/leoCottret/cbn-leocottret-mods/archive/refs/heads/main.zip",
        "commit_sha": "53b55a3b6e7fc2632f50111f560f4a72bdb7d13b",
        "extract_path": "MODS/XL_ARMORS_KENAN_MODPACK/XL_Armors_CBMArms"
      },
      "released_at": "2026-06-20T02:48:52.097Z"
    }
  ],
  "yanked": {
    "reason": "can re-fit armors into XL"
  },
  "dependencies": {
    "cbm_arms": "*"
  },
  "source": {
    "type": "github_archive",
    "url": "https://github.com/leoCottret/cbn-leocottret-mods/archive/refs/heads/main.zip",
    "commit_sha": "2a877689a9c119da012e84146b1355f325c3a0bd",
    "extract_path": "MODS/XL_ARMORS_KENAN_MODPACK/XL_Armors_CBMArms"
  },
  "categories": [
    "content"
  ],
  "modinfo_url": "https://raw.githubusercontent.com/leoCottret/cbn-leocottret-mods/57778ad68c1271f1e7069e5c6a0cebdfd40fa01a/MODS/XL_ARMORS_KENAN_MODPACK/XL_Armors_CBMArms/modinfo.json",
  "uses_lua": false,
  "autoupdate": {
    "type": "commit",
    "branch": "main"
  },
  "last_updated": "2026-06-25T02:41:17.787Z"
}
