{
  "schema_version": "1.0",
  "id": "necro_find",
  "display_name": "Necropolis Actually Findable",
  "short_description": "Tired of all that futile search for Necropolis? Sick after checking 5165846512354 overmaps to no avail? Worry no more, this mod solves that problem! It makes Necropolis findable by making it spawn in",
  "author": [
    "Stormtrooper"
  ],
  "license": "ALL-RIGHTS-RESERVED",
  "homepage": "https://github.com/Zlorthishen/BrightNights-Structured-Kenan-Modpack/tree/master/Kenan-BrightNights-Structured-Modpack/High-Maintenance-Huge-Mods/Necropolis_findable",
  "version": "0.0.0",
  "yanked": {
    "reason": "Kenan modpack entries are no longer tracked in this registry."
  },
  "dependencies": {
    "bn": ">=0.9.1"
  },
  "source": {
    "type": "github_archive",
    "url": "https://github.com/Zlorthishen/BrightNights-Structured-Kenan-Modpack/archive/refs/heads/master.zip",
    "commit_sha": "142b53ba0079e9c0aea3e8e674ad17a7dc193d07",
    "extract_path": "Kenan-BrightNights-Structured-Modpack/High-Maintenance-Huge-Mods/Necropolis_findable"
  },
  "categories": [
    "rebalance"
  ],
  "modinfo_url": "https://raw.githubusercontent.com/Zlorthishen/BrightNights-Structured-Kenan-Modpack/142b53ba0079e9c0aea3e8e674ad17a7dc193d07/Kenan-BrightNights-Structured-Modpack/High-Maintenance-Huge-Mods/Necropolis_findable/modinfo.json",
  "uses_lua": false,
  "autoupdate": {
    "type": "commit",
    "branch": "master"
  },
  "last_updated": "2026-06-22T03:33:52Z"
}
