{
  "schema_version": "1.0",
  "id": "overhaul",
  "display_name": "Overhaul Tileset",
  "short_description": "Anime-style graphical tileset for Bright Nights.",
  "description": "Anime-style tileset mod with character, appearance, mutation, and interface graphics for Bright Nights.",
  "author": [
    "비창",
    "고양이",
    "Xotto",
    "로갤"
  ],
  "license": "ALL-RIGHTS-RESERVED",
  "homepage": "https://github.com/scarf005/Overhaul",
  "version": "0.0.2",
  "dependencies": {
    "bn": ">=0.9.1"
  },
  "source": {
    "type": "github_archive",
    "url": "https://github.com/scarf005/Overhaul/archive/refs/tags/v0.0.2.zip",
    "commit_sha": "d06d0f24ac4be9435ec72a96edc301953140b0ee",
    "extract_path": "Overhaul-0.0.2/overhaul"
  },
  "categories": [
    "graphical"
  ],
  "tags": [
    "tileset",
    "appearance"
  ],
  "icon_url": "https://raw.githubusercontent.com/scarf005/Overhaul/v0.0.2/icon.webp",
  "modinfo_url": "https://raw.githubusercontent.com/scarf005/Overhaul/d06d0f24ac4be9435ec72a96edc301953140b0ee/overhaul/modinfo.json",
  "uses_lua": false,
  "autoupdate": {
    "type": "tag",
    "update_url": "https://github.com/scarf005/Overhaul",
    "regex": "^v[0-9]"
  },
  "last_updated": "2026-06-21T02:17:05Z"
}
