{
  "schema_version": "1.0",
  "id": "casingcrafting",
  "display_name": "Craftable Bullet Casings",
  "short_description": "Adding craft recipes to bullet casings, as well as brass itself. May be OP and unbalanced",
  "description": "Adding craft recipes to bullet casings, as well as brass itself. May be OP and unbalanced",
  "author": [
    "GallantChar"
  ],
  "license": "ALL-RIGHTS-RESERVED",
  "homepage": "https://github.com/Gallant-Char-25/CataclysmBN_Craftable_Casings_Mod",
  "version": "2026.6.13-bf804b2",
  "previous_releases": [
    {
      "version": "0.0.0",
      "source": {
        "type": "github_archive",
        "url": "https://github.com/Gallant-Char-25/CataclysmBN_Craftable_Casings_Mod/archive/refs/heads/main.zip",
        "commit_sha": "bf804b2ab2e456940ca3dca59530d339b19213f8"
      },
      "released_at": "2026-05-16T09:24:46.031Z"
    },
    {
      "version": "2026.6.8-bf804b2",
      "source": {
        "type": "github_archive",
        "url": "https://github.com/Gallant-Char-25/CataclysmBN_Craftable_Casings_Mod/archive/refs/heads/main.zip",
        "commit_sha": "bf804b2ab2e456940ca3dca59530d339b19213f8"
      },
      "released_at": "2026-06-08T03:03:00.171Z"
    },
    {
      "version": "2026.6.9-bf804b2",
      "source": {
        "type": "github_archive",
        "url": "https://github.com/Gallant-Char-25/CataclysmBN_Craftable_Casings_Mod/archive/refs/heads/main.zip",
        "commit_sha": "bf804b2ab2e456940ca3dca59530d339b19213f8"
      },
      "released_at": "2026-06-09T02:39:51.638Z"
    },
    {
      "version": "2026.6.10-bf804b2",
      "source": {
        "type": "github_archive",
        "url": "https://github.com/Gallant-Char-25/CataclysmBN_Craftable_Casings_Mod/archive/refs/heads/main.zip",
        "commit_sha": "bf804b2ab2e456940ca3dca59530d339b19213f8"
      },
      "released_at": "2026-06-10T02:55:37.314Z"
    },
    {
      "version": "2026.6.11-bf804b2",
      "source": {
        "type": "github_archive",
        "url": "https://github.com/Gallant-Char-25/CataclysmBN_Craftable_Casings_Mod/archive/refs/heads/main.zip",
        "commit_sha": "bf804b2ab2e456940ca3dca59530d339b19213f8"
      },
      "released_at": "2026-06-11T02:57:59.825Z"
    },
    {
      "version": "2026.6.12-bf804b2",
      "source": {
        "type": "github_archive",
        "url": "https://github.com/Gallant-Char-25/CataclysmBN_Craftable_Casings_Mod/archive/refs/heads/main.zip",
        "commit_sha": "bf804b2ab2e456940ca3dca59530d339b19213f8"
      },
      "released_at": "2026-06-12T03:01:21.207Z"
    }
  ],
  "dependencies": {
    "bn": ">=0.9.1"
  },
  "source": {
    "type": "github_archive",
    "url": "https://github.com/Gallant-Char-25/CataclysmBN_Craftable_Casings_Mod/archive/refs/heads/main.zip",
    "commit_sha": "bf804b2ab2e456940ca3dca59530d339b19213f8"
  },
  "categories": [
    "items"
  ],
  "modinfo_url": "https://raw.githubusercontent.com/Gallant-Char-25/CataclysmBN_Craftable_Casings_Mod/bf804b2ab2e456940ca3dca59530d339b19213f8/modinfo.json",
  "uses_lua": false,
  "autoupdate": {
    "type": "commit",
    "branch": "main"
  },
  "last_updated": "2026-06-13T02:48:41.698Z"
}
