{
  "schema_version": "1.0",
  "id": "realdarkskies_cata_patchmod",
  "display_name": "Really Dark Skies plus Cataclysm++",
  "short_description": "A patchmod for Really Dark Skies which adds increased support for Cataclysm++ mod",
  "description": "A patchmod for Really Dark Skies which adds increased support for Cataclysm++ mod",
  "author": [
    "Zlorthishen"
  ],
  "license": "ALL-RIGHTS-RESERVED",
  "homepage": "https://github.com/Zlorthishen/Really_Dark_Skies/tree/main/Patch_mods/RDS_plus_Cata",
  "version": "2026.6.10-4e6abff",
  "previous_releases": [
    {
      "version": "0.0.0",
      "source": {
        "type": "github_archive",
        "url": "https://github.com/Zlorthishen/Really_Dark_Skies/archive/refs/heads/main.zip",
        "commit_sha": "4e6abff37d33cfaac6cc43ff1eedcdf5abea17ea",
        "extract_path": "Patch_mods/RDS_plus_Cata"
      },
      "released_at": "2026-05-16T09:24:59.312Z"
    },
    {
      "version": "2026.6.8-4e6abff",
      "source": {
        "type": "github_archive",
        "url": "https://github.com/Zlorthishen/Really_Dark_Skies/archive/refs/heads/main.zip",
        "commit_sha": "4e6abff37d33cfaac6cc43ff1eedcdf5abea17ea",
        "extract_path": "Patch_mods/RDS_plus_Cata"
      },
      "released_at": "2026-06-08T03:03:03.439Z"
    },
    {
      "version": "2026.6.9-4e6abff",
      "source": {
        "type": "github_archive",
        "url": "https://github.com/Zlorthishen/Really_Dark_Skies/archive/refs/heads/main.zip",
        "commit_sha": "4e6abff37d33cfaac6cc43ff1eedcdf5abea17ea",
        "extract_path": "Patch_mods/RDS_plus_Cata"
      },
      "released_at": "2026-06-09T02:39:54.868Z"
    }
  ],
  "dependencies": {
    "bn": ">=0.9.1",
    "realdarkskies": "*",
    "cata++": "*"
  },
  "source": {
    "type": "github_archive",
    "url": "https://github.com/Zlorthishen/Really_Dark_Skies/archive/refs/heads/main.zip",
    "commit_sha": "4e6abff37d33cfaac6cc43ff1eedcdf5abea17ea",
    "extract_path": "Patch_mods/RDS_plus_Cata"
  },
  "categories": [
    "misc_additions"
  ],
  "modinfo_url": "https://raw.githubusercontent.com/Zlorthishen/Really_Dark_Skies/4e6abff37d33cfaac6cc43ff1eedcdf5abea17ea/Patch_mods/RDS_plus_Cata/modinfo.json",
  "uses_lua": false,
  "autoupdate": {
    "type": "commit",
    "branch": "main"
  },
  "parent": "realdarkskies",
  "last_updated": "2026-06-10T02:55:35.830Z"
}
